"ΟΝΟΜΑΣΙΑ ΟΤΑ";ΝΟΜΟΣ;ΕΤΟΣ;"ΕΓΓΕΓΡΑΜΜΕΝΟΙ (Α)";"ΕΓΓΕΓΡΑΜΜΕΝΟΙ (Β)";"ΨΗΦΙΣΑΝΤΕΣ (Α)";"ΨΗΦΙΣΑΝΤΕΣ (Β)";"ΕΓΚΥΡΑ (Α)";"ΕΓΚΥΡΑ (Β)";ΥΠΟΨΗΦΙΟΣ;ΣΥΝΔΥΑΣΜΟΣ;"ΨΗΦΟΙ (Α)";"ΨΗΦΟΙ (Β)";ΕΔΡΕΣ;ΕΚΛΟΓΗ
"Δ. Αλυκών";Ζακύνθου;2006;7176;;4122;;3961;;"ΓΚΟΥΣΚΟΣ ΑΝΤΩΝΙΟΣ";"ΕΝΩΤΙΚΗ ΔΗΜΙΟΥΡΓΙΚΗ ΠΡΩΤΟΒΟΥΛΙΑ ΔΗΜΟΥ ΑΛΥΚΩΝ";2117;;8;1
"Δ. Αλυκών";Ζακύνθου;2006;7176;;4122;;3961;;"ΠΕΤΤΑΣ ΙΩΑΝΝΗΣ";"ΔΗΜΟΤΙΚΗ ΚΙΝΗΣΗ ΔΗΜΟΥ ΑΛΥΚΩΝ ΓΙΑΝΝΗΣ ΠΕΤΑΣ";1622;;5;
"Δ. Αλυκών";Ζακύνθου;2006;7176;;4122;;3961;;"ΠΟΤΑΜΙΤΗΣ ΒΑΣΙΛΕΙΟΣ";"ΔΗΜΟΤΙΚΗ ΑΓΩΝΙΣΤΙΚΗ ΚΙΝΗΣΗ ΑΛΥΚΩΝ";222;;;
"Δ. Αλυκών";Ζακύνθου;2002;7957;;4134;;3875;;"ΠΕΤΤΑΣ ΙΩΑΝΝΗΣ";"ΔΗΜΟΤΙΚΗ ΚΙΝΗΣΗ ΔΗΜΟΥ ΑΛΥΚΩΝ";2118;;12;1
"Δ. Αλυκών";Ζακύνθου;2002;7957;;4134;;3875;;"ΓΚΟΥΣΚΟΣ ΔΗΜΗΤΡΙΟΣ";"ΝΕΑ ΠΟΡΕΙΑ";1367;;6;
"Δ. Αλυκών";Ζακύνθου;2002;7957;;4134;;3875;;"ΠΟΤΑΜΙΤΗΣ ΒΑΣΙΛΕΙΟΣ";"ΔΗΜΟΤΙΚΗ ΑΓΩΝ. ΚΙΝΗΣΗ ΔΗΜΟΥ ΑΛΥΚΩΝ";390;;1;
"Δ. Αλυκών";Ζακύνθου;1998;5034;5034;4097;3985;3896;3777;"ΠΥΡΙΟΧΟΣ ΖΗΣΙΜΟΣ";"ΑΝΕΞΑΡΤΗΤΗ ΔΗΜΟΤΙΚΗ ΚΙΝΗΣΗ ΔΗΜΟΥ ΑΛΥΚΩΝ";1933;1903;11;1
"Δ. Αλυκών";Ζακύνθου;1998;5034;5034;4097;3985;3896;3777;"ΒΟΥΤΟΣ ΣΠΥΡΙΔΩΝ";"ΔΗΜΟΤΙΚΗ ΠΡΟΟΔΕΥΤΙΚΗ ΣΥΝΕΡΓΑΣΙΑ";1648;1874;6;
"Δ. Αλυκών";Ζακύνθου;1998;5034;5034;4097;3985;3896;3777;"ΒΙΣΒΑΡΔΗΣ ΠΕΤΡΟΣ";"ΔΗΜΟΤΙΚΗ ΑΓΩΝΙΣΤΙΚΗ ΣΥΝΕΡΓΑΣΙΑ ΑΛΥΚΩΝ (Δ.Α.Σ.Α.)";315;;;
