"ΟΝΟΜΑΣΙΑ ΟΤΑ";ΝΟΜΟΣ;ΕΤΟΣ;"ΕΓΓΕΓΡΑΜΜΕΝΟΙ (Α)";"ΕΓΓΕΓΡΑΜΜΕΝΟΙ (Β)";"ΨΗΦΙΣΑΝΤΕΣ (Α)";"ΨΗΦΙΣΑΝΤΕΣ (Β)";"ΕΓΚΥΡΑ (Α)";"ΕΓΚΥΡΑ (Β)";ΥΠΟΨΗΦΙΟΣ;ΣΥΝΔΥΑΣΜΟΣ;"ΨΗΦΟΙ (Α)";"ΨΗΦΟΙ (Β)";ΕΔΡΕΣ;ΕΚΛΟΓΗ
"Δ. Μανταμάδου";Λέσβου;2006;3836;;2438;;2329;;"ΑΠΟΣΤΟΛΟΥ ΣΤΕΦΑΝΟΣ";"ΝΕΟ ΞΕΚΙΝΗΜΑ";1283;;8;1
"Δ. Μανταμάδου";Λέσβου;2006;3836;;2438;;2329;;"ΚΑΡΑΤΖΙΤΖΗΣ ΔΗΜΗΤΡΙΟΣ";"ΕΝΟΤΗΤΑ και ΑΝΑΠΤΥΞΗ ΤΩΝ ΧΩΡΙΩΝ ΜΑΣ";1046;;5;
"Δ. Μανταμάδου";Λέσβου;2002;4019;;2437;;2307;;"ΑΠΟΣΤΟΛΟΥ ΣΤΕΦΑΝΟΣ";"ΝΕΟ ΞΕΚΙΝΗΜΑ";1168;;9;1
"Δ. Μανταμάδου";Λέσβου;2002;4019;;2437;;2307;;"ΚΑΡΑΤΖΙΤΖΗΣ ΔΗΜΗΤΡΙΟΣ";"ΕΝΟΤΗΤΑ ΚΑΙ ΑΝΑΠΤΥΞΗ ΤΩΝ ΧΩΡΙΩΝ ΜΑΣ";1139;;6;
"Δ. Μανταμάδου";Λέσβου;1998;3680;;2569;;2397;;"ΚΑΡΑΤΖΙΤΖΗΣ ΔΗΜΗΤΡΙΟΣ";"ΕΝΟΤΗΤΑ ΚΑΙ ΑΝΑΠΤΥΞΗ ΤΩΝ ΧΩΡΙΩΝ ΜΑΣ";1671;;11;1
"Δ. Μανταμάδου";Λέσβου;1998;3680;;2569;;2397;;"ΖΑΦΕΙΡΙΟΥ ΔΗΜΗΤΡΙΟΣ";"ΛΑΪΚΗ ΕΝΤΟΛΗ ΓΙΑ ΔΗΜΙΟΥΡΓΙΑ";726;;4;
