"ΟΝΟΜΑΣΙΑ ΟΤΑ";ΝΟΜΟΣ;ΕΤΟΣ;"ΕΓΓΕΓΡΑΜΜΕΝΟΙ (Α)";"ΕΓΓΕΓΡΑΜΜΕΝΟΙ (Β)";"ΨΗΦΙΣΑΝΤΕΣ (Α)";"ΨΗΦΙΣΑΝΤΕΣ (Β)";"ΕΓΚΥΡΑ (Α)";"ΕΓΚΥΡΑ (Β)";ΥΠΟΨΗΦΙΟΣ;ΣΥΝΔΥΑΣΜΟΣ;"ΨΗΦΟΙ (Α)";"ΨΗΦΟΙ (Β)";ΕΔΡΕΣ;ΕΚΛΟΓΗ
"Δ. Αρμένων";Χανίων;2006;4454;;3143;;3039;;"ΒΛΑΧΑΚΗΣ ΠΕΤΡΟΣ";"ΑΝΕΞΑΡΤΗΤΗ ΣΥΝΕΡΓΑΣΙΑ ΔΗΜΟΥ ΑΡΜΕΝΩΝ";1654;;8;1
"Δ. Αρμένων";Χανίων;2006;4454;;3143;;3039;;"ΚΑΡΑΓΙΑΝΝΑΚΗΣ ΠΑΝΤΕΛΗΣ";"ΑΝΕΞΑΡΤΗΤΗ ΕΝΩΤΙΚΗ ΚΙΝΗΣΗ ΔΗΜΟΥ ΑΡΜΕΝΩΝ";1187;;5;
"Δ. Αρμένων";Χανίων;2006;4454;;3143;;3039;;"ΚΑΤΣΑΡΟΣ ΙΩΑΝΝΗΣ";"ΔΗΜΟΤΙΚΗ ΑΓΩΝΙΣΤΙΚΗ ΚΙΝΗΣΗ ΔΗΜΟΥ ΑΡΜΕΝΩΝ";198;;;
"Δ. Αρμένων";Χανίων;2002;4510;4511;3028;3030;2920;2958;"ΚΑΡΑΓΙΑΝΝΑΚΗΣ ΠΑΝΤΕΛΗΣ";"ΑΝΕΞΑΡΤΗΤΗ ΕΝΩΤΙΚΗ ΚΙΝΗΣΗ ΔΗΜΟΥ ΑΡΜΕΝΩΝ";1430;1576;9;1
"Δ. Αρμένων";Χανίων;2002;4510;4511;3028;3030;2920;2958;"ΒΛΑΧΑΚΗΣ ΔΗΜΟΣΘΕΝΗΣ";"ΕΝΩΤΙΚΗ ΔΗΜ ΚΙΝΗΣΗ";1277;1382;6;
"Δ. Αρμένων";Χανίων;2002;4510;4511;3028;3030;2920;2958;"ΚΑΤΣΑΡΟΣ ΙΩΑΝΝΗΣ";"ΔΗΜ ΑΓΩΝ ΚΙΝΗΣΗ Δ ΑΡΜΕΝΩΝ";213;;;
"Δ. Αρμένων";Χανίων;1998;4172;;3072;;2964;;"ΚΑΡΑΓΙΑΝΝΑΚΗΣ ΠΑΝΤΕΛΗΣ";"ΑΝΕΞΑΡΤΗΤΗ ΕΝΩΤΙΚΗ ΚΙΝΗΣΗ";1629;;9;1
"Δ. Αρμένων";Χανίων;1998;4172;;3072;;2964;;"ΚΟΤΡΩΝΑΚΗΣ ΑΝΤΩΝΙΟΣ";"ΕΝΩΤΙΚΗ ΠΟΡΕΙΑ";1006;;5;
"Δ. Αρμένων";Χανίων;1998;4172;;3072;;2964;;"ΑΤΣΑΛΑΚΗΣ ΙΩΑΝΝΗΣ";"ΑΝΕΞΑΡΤΗΤΗ ΕΝΩΤΙΚΗ ΔΗΜΟΤΙΚΗ ΚΙΝΗΣΗ";329;;1;
