"ΟΝΟΜΑΣΙΑ ΟΤΑ";ΝΟΜΟΣ;ΕΤΟΣ;"ΕΓΓΕΓΡΑΜΜΕΝΟΙ (Α)";"ΕΓΓΕΓΡΑΜΜΕΝΟΙ (Β)";"ΨΗΦΙΣΑΝΤΕΣ (Α)";"ΨΗΦΙΣΑΝΤΕΣ (Β)";"ΕΓΚΥΡΑ (Α)";"ΕΓΚΥΡΑ (Β)";ΥΠΟΨΗΦΙΟΣ;ΣΥΝΔΥΑΣΜΟΣ;"ΨΗΦΟΙ (Α)";"ΨΗΦΟΙ (Β)";ΕΔΡΕΣ;ΕΚΛΟΓΗ
"Δ. Φαιάκων";Κερκύρας;2006;5872;;4365;;4006;;"ΚΑΡΡΑΣ ΜΙΧΑΗΛ";"ΟΛΟΙ ΜΑΖΙ ΓΙΑ ΤΗΝ ΠΡΟΟΔΟ ΤΟΥ ΔΗΜΟΥ ΦΑΙΑΚΩΝ";2692;;12;1
"Δ. Φαιάκων";Κερκύρας;2006;5872;;4365;;4006;;"ΜΕΤΑΛΛΗΝΟΣ ΣΕΒΑΣΤΙΑΝΟΣ";"ΝΕΑ ΠΡΟΟΠΤΙΚΗ ΓΙΑ ΤΟ ΔΗΜΟ ΦΑΙΑΚΩΝ";1314;;5;
"Δ. Φαιάκων";Κερκύρας;2002;5870;;4613;;4393;;"ΚΑΡΡΑΣ ΜΙΧΑΗΛ";"ΟΛΟΙ ΜΑΖΙ ΓΙΑ ΤΗΝ ΠΡΟΟΔΟ ΤΟΥ ΔΗΜΟΥ ΦΑΙΑΚΩΝ";2436;;13;1
"Δ. Φαιάκων";Κερκύρας;2002;5870;;4613;;4393;;"ΔΗΜΟΥΛΑΣ ΙΩΑΝΝΗΣ";"ΑΔΕΣΜΕΥΤΗ ΚΙΝΗΣΗ ΔΗΜΟΥ ΦΑΙΑΚΩΝ";1003;;4;
"Δ. Φαιάκων";Κερκύρας;2002;5870;;4613;;4393;;"ΒΡΑΔΗΣ ΙΩΑΝΝΗΣ";"ΑΝΕΞΑΡΤΗΤΗ ΔΗΜΟΚΡΑΤΙΚΗ ΚΙΝΗΣΗ";954;;4;
"Δ. Φαιάκων";Κερκύρας;1998;6693;7132;4431;4461;4196;4329;"ΣΑΒΒΑΝΗΣ ΣΤΑΥΡΟΣ";"ΑΓΩΝΙΣΤΙΚΗ ΔΗΜΟΚΡΑΤΙΚΗ ΣΥΝΕΡΓΑΣΙΑ";1884;2077;7;
"Δ. Φαιάκων";Κερκύρας;1998;6693;7132;4431;4461;4196;4329;"ΚΑΡΡΑΣ ΜΙΧΑΗΛ";"ΕΝΩΜΕΝΟΙ ΓΙΑ ΤΗΝ ΠΡΟΟΔΟ ΤΟΥ ΔΗΜΟΥ ΦΑΙΑΚΩΝ";1881;2252;13;1
"Δ. Φαιάκων";Κερκύρας;1998;6693;7132;4431;4461;4196;4329;"ΓΙΣΔΑΚΗΣ ΜΑΤΘΑΙΟΣ";"ΑΝΕΞΑΡΤΗΤΗ ΔΗΜΟΤΙΚΗ ΚΙΝΗΣΗ";431;;1;
